0,STEINS;GATE, WHITE FOX,2011,舞台は2010年夏の秋葉原。厨二病から抜け出せない大学生である岡部倫太郎は、｢未来ガジェット研究所｣を立ち上げ、用途不明の発明品を日々生み出していた。だが、ある日、偶然にも過去へとメールが送れる｢タイムマシン｣を作り出す。世紀の発明と興奮を抑えきれずに、興味本位で過去への干渉を繰り返す。その結果、世界を巻き込む大きな悲劇が、岡部たちに訪れることになるのだが・・・悲劇を回避するために、岡部の孤独な戦いが始まる。果たして彼は、運命を乗り越えることができるのか!?,https://res.cloudinary.com/hggksoylm/image/upload/v1598080916/Animation/steinsgate_odrbxo.png,し,しゅたいんずげーと
0,シュタインズ・ゲート ゼロ,WHITE FOX,2018,2010年冬 β世界線―――主人公・岡部倫太郎が数々の苦難、悲哀を乗り越えた果てに「彼女」を救うことをあきらめてしまった世界線。失意の底にある岡部倫太郎。彼を心配する仲間たち。救われなかった「彼女」はどうなったのか？新たなキャラクターを迎えて描かれる「ゼロ」の物語。,https://res.cloudinary.com/hggksoylm/image/upload/v1598080922/Animation/steinsgatezero_b1zyb1.png,し,しゅたいんずげーとぜろ
0,少女☆歌劇 レヴュースタァライト, キネマシトラス,2018,『スタァ』――それは舞台の中心、「ポジション・ゼロ」に煌めく光。心を震わせる歌声で、躰が動きだす踊りで、魂を揺さぶる演技で観る者を魅了する、舞台に咲き誇る華。スタァに魅入られた『舞台少女』たちは、夢の舞台に立つために演劇の学び舎『聖翔音楽学園』に集う。愛城華恋。天堂真矢。星見純那。露崎まひる。大場なな。西條クロディーヌ。石動双葉。花柳香子。そして――神楽ひかり。9人の舞台少女に突然届いた謎のメール。「お持ちなさい　　あなたの望んだその星を」それは『トップスタァ』の座をかけた、オーディションへの誘い。同じ舞台にたつ仲間は、星を奪い合うライバルとなった。剥き出しの情熱が、愛ゆえの傲慢が、譲れない執着が、舞台の上で激突し――関係が、感情が、主役と敵役が、緞帳が上がるたびに再生産されてゆく。9人の舞台少女たちの、キラめきをかけた『レヴュー』。「いつか、あの子と戦うことになっても――」運命に導かれた舞台が、今――幕を開ける。,https://res.cloudinary.com/hggksoylm/image/upload/v1598080927/Animation/syojokageki_bo8puw.png,し,しょうじょかげきれびゅーすたーらいと
0,少女たちは荒野を目指す,project No.9,2016,神奈川県、金沢百景。風光明媚なその地で学生生活を送る少年、北条文太郎には、将来の夢がなかった。やりたいことを見つけられない、そんな焦りを抱き始めていたある日、彼はミステリアスな同級生の少女から、一緒にゲームを作らないかと持ちかけられる。その提案に、初めて何かを成し遂げることができるかもしれないという予感を感じた文太郎。そして、彼はついに一歩を踏み出した。いざ往かん。この世の荒野に、仲間たちとともに―?。,https://res.cloudinary.com/hggksoylm/image/upload/v1598080932/Animation/syojotatihakouyawomezasu_abjnss.png,し,しょうじょたちはこうやをめざす
0,消滅都市,マッドハウス,2019,ある日、ひとつの都市が消滅した――　一匹狼の運び屋の男タクヤと、消滅から唯一生還したと言われる少女ユキ。ふたりは、消息を絶ったと思われていたユキの父親からのメッセージを頼りに消滅都市へと向かうことになる。しかし、そんなふたりの前に思わぬ障害が立ちはだかる。それはユキにとって、あまりに衝撃的な現実で――残された人の想い、暗躍する謎の組織、そして隠された陰謀。タクヤとユキ、全くの他人だったふたりは、旅の中で絆を深めつつ、消滅都市の謎へと迫ってゆく。,https://res.cloudinary.com/hggksoylm/image/upload/v1598080937/Animation/syoumetutosi_i3lps5.png,し,しょうめつとし
0,昭和元禄落語心中,スタジオディーン,2016,刑務所の落語慰問会で見た大名人・八雲の｢死神｣が忘れられず、出所した与太郎が真っ先に向かった先は、寄席だった。拝み倒して八雲の住み込みの弟子となった与太郎だが、八雲の元では小夏という女性が暮らしていた。八雲と小夏には他人が容易に触れられない因縁があるらしく・・・。,https://res.cloudinary.com/hggksoylm/image/upload/v1598080942/Animation/syowagenrokurakugosinju_la9rbf.png,し,しょうわげんろくらくごしんじゅう
0,食戟のソーマ,J.C.STAFF,2015,下町の定食屋｢ゆきひら｣では、今日も父・城一郎と息子・創真が料理対決を繰り広げていた――。中学を卒業したら実家｢ゆきひら｣で料理の修行をし、父を越える料理人を目指そうとしていた創真。だが突然の休業、そして父の提案により、日本屈指の料理学校｢遠月茶寮料理學園｣(遠月学園)の編入試験を受けることに。そこは最高峰の料理人だけを育てる、卒業到達率10%以下の超絶エリート校だった……。,https://res.cloudinary.com/hggksoylm/image/upload/v1598080948/Animation/syokugekinosoma_azfn7v.png,し,しょくげきのそーま
0,食戟のソーマ 弐ノ皿,J.C.STAFF,2016,実家の下町の定食屋｢ゆきひら｣を手伝う日々を送っていた幸平創真は、中学校卒業と同時に、ある料理学校への編入を父・城一郎に薦められる。それは日本屈指の料理学校｢遠月茶寮料理學園｣……卒業到達率10%以下の超エリート校だった。厳しい試験、脱落者続出の地獄の宿泊研修、退学を賭けた食戟。様々な試練を乗り越え、料理の腕を磨いていく創真。同じ志を持つ仲間や、同世代の実力者たちと出会い、一人の人間としても確実に成長を続けていた。――そして迎えた秋。一年生の中でも選ばれた者しか出場を許されない遠月伝統｢秋の選抜｣、その出場切符を創真は手にする。｢秋の選抜｣予選のお題は“カレー料理”。優勝候補でスパイスの使い手、葉山アキラの作るカレーにスパイスの奥深さを知った創真は葉山の宣戦布告に受けて立つべく、スパイスと格闘。予選当日の朝まで試行錯誤して調理に臨み、葉山と同じ“香りの爆弾”という発想に行き着いたが、結果は葉山94点、創真93点と僅差で葉山が一位に。葉山に敗れはしたものの、見事に本戦出場を決めた創真。悔しさを滲ませながらも、さらに強くなることを心に誓い、かくして迎える｢秋の選抜｣本戦。トーナメントに肩を並べたのは、創真、恵、タクミ、緋沙子、アリス、黒木場、葉山、美作、の8名。次なる創真の相手は……！？そして、てっぺんを取るのは……！？,https://res.cloudinary.com/hggksoylm/image/upload/v1598080952/Animation/syokugekinosoma2_cbvkfy.png,し,しょくげきのそーま2
0,食戟のソーマ 餐ノ皿,J.C.STAFF,2017,実家の定食屋「ゆきひら」を手伝いながら料理の腕を磨いてきた幸平創真は、超エリート料理学校「遠月茶寮料理學園」へと入学する。創真は学園で様々な料理人たちと出会い、成長を続けるなかで「自分だけの料理」を模索し始めていた。実際の料理の現場へ赴き実戦を学ぶカリキュラム「実地研修（スタジエール）」でさらなる経験を積んだ創真は、“これまでの自分（ゆきひら）”を破ることで、新たな“「ゆきひら」の料理”へと辿り着く。実地研修の課題もクリアし、また一つ成長を遂げたのだった。実地研修を終え、食戟でさらなる研鑽を重ねる日々を送る創真は「紅葉狩り会」の場で、ついに相見えた学園の頂点、遠月十傑にも勝負を挑む。創真が十傑と勝負するために目をつけたのは、遠月恒例行事である学園祭――その名も「月饗祭」。毎年50万人が訪れる怪物イベントで、彼は何を起こすのか!?一方、その裏ではある人物による計画が動き始め――？創真の新たな戦いが幕を開ける！,https://res.cloudinary.com/hggksoylm/image/upload/v1598080958/Animation/syokugekinosoma3_tymyjj.png,し,しょくげきのそーま3
0,食戟のソーマ 餐ノ皿「遠月列車篇」,J.C.STAFF,2017,実家の定食屋「ゆきひら」を手伝いながら料理の腕を磨いてきた幸平創真は、超エリート料理学校「遠月茶寮料理學園」へと入学する。創真は学園で様々な料理人たちと出会い、成長を続けるなかで「自分だけの料理」を模索し始めていた。実際の料理の現場へ赴き実戦を学ぶカリキュラム「実地研修（スタジエール）」でさらなる経験を積んだ創真は、“これまでの自分（ゆきひら）”を破ることで、新たな“「ゆきひら」の料理”へと辿り着く。実地研修の課題もクリアし、また一つ成長を遂げたのだった。実地研修を終え、食戟でさらなる研鑽を重ねる日々を送る創真は「紅葉狩り会」の場で、ついに相見えた学園の頂点、遠月十傑にも勝負を挑む。創真が十傑と勝負するために目をつけたのは、遠月恒例行事である学園祭――その名も「月饗祭」。毎年50万人が訪れる怪物イベントで、彼は何を起こすのか!?一方、その裏ではある人物による計画が動き始め――？創真の新たな戦いが幕を開ける！,https://res.cloudinary.com/hggksoylm/image/upload/v1598080963/Animation/syokugekinosoma4_y186vd.png,し,しょくげきのそーま4
0,食戟のソーマ 神ノ皿,J.C.STAFF,2019,超エリート料理学校「遠月茶寮料理學園」に入学した幸平創真は、仲間たちとともに日々研鑽の日々を過ごしていた。しかし、薙切薊が新総帥の座に就いたことで状況が一変。自由な活動を抑制されてしまった創真たちは、窮地を脱するために新遠月十傑との連隊食戟を開始！初戦に圧勝した反逆者チームは、勢いもそのままに新遠月十傑との2nd BOUTに挑む!!,https://res.cloudinary.com/hggksoylm/image/upload/v1598080969/Animation/syokugekinosoma5_ap58ge.png,し,しょくげきのそーま5
0,食戟のソーマ 豪ノ皿,J.C.STAFF,2020,実家の定食屋「食事処ゆきひら」で料理の腕を磨いていた幸平創真は、父親の勧めで超エリート料理学校「遠月茶寮料理學園」に入学。ライバルとの食戟、仲間との研鑽を重ね、料理人として徐々に成長を続けていた。時が経ち、２年生に進級した創真はついに学園の頂点、遠月十傑評議会“第一席”の座へと、のぼりつめたのだった――。そんななか、世界的な料理コンクール「THE BLUE」の招待状が遠月学園へと届く。「THE BLUE」とは、若手料理人たちが名声を懸け競う正統派な美食大会――しかし、今回は従来とは趣向が異なり、常軌を逸したお題ばかり!?新たなライバルが現れ、波乱の予感が漂う「THE BLUE」の行方は……!?次代の料理界の担い手を決める食戟が、幕を開ける！,https://res.cloudinary.com/hggksoylm/image/upload/v1598080974/Animation/syokugekinosoma6_fvhkrv.png,し,しょくげきのそーま6
0,しろくまカフェ,studioぴえろ,2012,クールなシロクマくんがマスターをしている“しろくまカフェ”。お店は毎日、動物や人間のお客さんで大繁盛しています。 カフェを中心に、シロクマくんと常連さんたちが繰り広げるダジャレ&ほっこりスローライフ。今日もとぼけた会話が弾みます。,https://res.cloudinary.com/hggksoylm/image/upload/v1598080980/Animation/shirokumacafe_vlirx6.png,し,しろくまかふぇ
0,白猫プロジェクト ZERO CHRONICLE,project No.9,2020,ずっとずっと昔の時代、天空には白の王国が、地上には黒の王国があり、〈均衡〉を保ちつつ〈循環〉していた。ある時、黒の王国で魔獣に襲われ壊滅した村で、少年が墓を掘っていた。その少年の元へ、先代の闇の王候補者スキアーズが現れる。スキアーズに見出された少年は、闇の王子となってこの世界を変える事を決意する。一方、白の王国の守護神である光の王アイリスは、光と闇の均衡が破られる事を懸念していた。そこへ均衡を乱す存在バール出現の知らせが入る。黒の王国の闇の王は、目障りなバールを討つために盟約を申し入れる。光の王アイリスは、黒の王国からの使者闇の王子と出会い、共に平和な世界をもたらそうと〈約束〉する。だがふたりの〈約束〉は、闇の王によって踏みにじられる事となる。ふたりが交わした〈約束〉と、世界を滅ぼした始まりの罪。〈根源〉（ゼロ）へと至る物語が幕を開ける―――,https://res.cloudinary.com/hggksoylm/image/upload/v1598080985/Animation/sironekoproject_ptw4a1.png,し,しろねこぷろじぇくとぜろくろにくる
0,SHIROBAKO,P.A.WORKS,2014,武蔵野アニメーションの新人制作進行のあおいを中心として、アニメーション制作現場で起こるトラブルや、葛藤や挫折などといったアニメ業界の日常を描く群像劇。,https://res.cloudinary.com/hggksoylm/image/upload/v1598080990/Animation/shirobako_hkexpr.png,し,しろばこ
0,進撃の巨人,WIT STUDIO,2013,巨人がすべてを支配する世界。巨人の餌と化した人類は高さ50メートルの巨大な壁を築き、壁外への自由と引き換えに侵略を防いでいた…。まだ見ぬ壁外の世界を夢見る10歳の少年、エレン・イェーガー。エレンは仮初めの平和に満足し外の世界へ出ることを諦めた人々に違和感を覚える。彼らを｢家畜｣と呼ぶエレン。エレンを｢異物｣と感じる人々。だが、壁をも越える超大型巨人の出現により、エレンの｢夢｣も人々の｢平和｣も突如として崩れ去ってしまう……。,https://res.cloudinary.com/hggksoylm/image/upload/v1598080995/Animation/singekinokyozin_tuwbdn.png,し,しんげきのきょじん
0,進撃の巨人 Season 2,WIT STUDIO,2017,超大型巨人の出現により人類の平和と幻想が破られたあの日から、エレン・イェーガーの果てしない戦いの日々は続く……。抵抗する術もなく巨人の餌となった母の最期を目の当たりにして、この世から巨人を一匹残らず駆逐することを誓ったエレン。しかし、過酷な戦いの中で彼自身が巨人の姿に変貌してしまう――。人類の自由を勝ち取るために巨人の力を振るうエレンは、ウォール・シーナのストヘス区において｢女型の巨人｣と激突。巨人同士の激しい戦闘は、辛くもエレンの勝利となった。それでもエレンに、そして人類に、休息の時は訪れない。次なる戦いは既に始まりを告げている。ウォール・ローゼに迫り来る巨人の大群に、人類はどう立ち向かう！？,https://res.cloudinary.com/hggksoylm/image/upload/v1598081001/Animation/singekinokyozin2_ggardf.png,し,しんげきのきょじん2
0,進撃の巨人 Season 3,WIT STUDIO,2018,百年の長きに渡り人類と外の世界を隔ててきた壁。その壁の向こうには見たことのない世界が広がっているという。炎の水、氷の大地、砂の雪原……。本の中に書かれた言葉は、少年の探究心をかき立てるものばかりだった。やがて時が過ぎ、壁が巨人によって壊された現在、人類は一歩ずつ世界の真実へと近づこうとしている。巨人の正体は何なのか？何故、壁の中に巨人が埋まっていたのか？巨人化したエレン・イェーガーが持つ「座標」の力とは？そして、ヒストリア・レイスはこの世界の何を知るのか？エレンら104期兵を加え、新たな体制となったリヴァイ班。行動を開始した彼らの前に、最強最悪の敵が立ち塞がる。,https://res.cloudinary.com/hggksoylm/image/upload/v1598081006/Animation/singekinokyozin3_okietw.png,し,しんげきのきょじん3
0,新世界より,?A-1 Pictures,2012,“神の力”を手に入れた人類の運命を3部作で描く壮大な物語。新たな映像世界を切り開く超弩級エンターテインメントが誕生。原作は、日本SF大賞を受賞した貴志祐介の長編小説。2008年に発表され、各賞・各書評で大絶賛を浴びるなど大きな注目を集めながら、そのイマジネーションに満ちた特異な世界観と圧倒的な広がりを見せる壮大なストーリーから｢映像化不可能｣とまで言われた空前絶後のエンターテインメント。,https://res.cloudinary.com/hggksoylm/image/upload/v1598081012/Animation/sinsekaiyori_nxzcpo.png,し,しんせかいより
0,地獄先生ぬ～べ～,東映アニメーション,1996,童守小学校に赴任してきた5年3組担任の鵺野鳴介、通称ぬ～べ～。普段の彼は、ドジでおっちょこちょいなところはあるが、どこか憎めない愛すべき先生として生徒たちに親しまれている。しかしぬ～べ～には、日本でただ一人の霊能力教師という、もう一つの顔があった。 常に黒い手袋で覆われている彼の左手には、この世ならざる存在――悪霊や妖怪などに直接触れて、浄化することのできる最強の力｢鬼の手｣が封印されているのだ。その力は、かつてある生徒を救うため、わが身を賭して封じ込めた地獄の鬼のものだった。子供たちが｢闇の住人｣に襲われ、危機にさらされた時、ぬ～べ～必殺の｢鬼の手｣が闇を切り裂き、魔を祓う！はたして今日はどんな怪事件や不思議な出来事が、ぬ～べ～を待ち受けているのだろうか？,https://res.cloudinary.com/hggksoylm/image/upload/v1598081017/Animation/zigokusenseinube_z2bofj.png,じ,じごくせんせいぬーべー
0,実験品家族 -クリーチャーズ・ファミリー・デイズ-,Big Firebird Cultural Media Co．，Ltd,2018,とあるマッドサイエンティスト夫婦が屋敷にて違法研究に取り組み逮捕される。罪状は自らの子供たちへの遺伝子改造実験の実施であった。５人の子供たちの中で、唯一「普通の人間」として養育された末の弟、タニス。彼は一夜にして５人の兄弟姉妹たちのリーダー的存在となり、異なる個性を持ち合わせる兄と姉らの面倒を見ることに。そして両親の残した実験データを完成させる任務をも、一身に背負うこととなるのであった。,https://res.cloudinary.com/hggksoylm/image/upload/v1598093695/Animation/crituersfamilydays_w6prh1.png,く,くりーちゃーずふぁみりーでいず
0,ＧＩＡＮＴ ＫＩＬＬＩＮＧ,スタジオディーン,2010,低迷を続ける日本の弱小プロサッカー・クラブＥＴＵに一人の男が監督として迎えられた。男の名は達海猛（たつみ　たけし）。イングランド５部のアマチュアクラブを、ＦＡカップでベスト32に導き、プレミアリーグのクラブをギリギリまで追い詰めた手腕の人物だ。そんな彼に古巣のクラブが白羽の矢を立てた訳だが、チーム内は開幕前から騒動ばかり、果たしてこの起用は吉と出るか、凶と出るか!?,https://res.cloudinary.com/hggksoylm/image/upload/v1598081023/Animation/giantkilling_brkktm.png,じ,じゃいあんときりんぐ
0,邪神ちゃんドロップキック,ノーマッド,2018,魔界の悪魔、通称「邪神ちゃん」は、ある日突然人間界に召喚されてしまう。彼女を召喚したのは、神保町のボロアパートで暮らすちょっとブラックな心を持つ女子大生「花園ゆりね」。「邪神ちゃん」を召喚したものの彼女？を魔界に帰す方法がわからない。仕方なく一緒に暮らし始めた邪神ちゃんと「ゆりね」だが、「邪神ちゃん」曰く、「召喚者が死ねば魔界に帰れる」。そこで邪神ちゃんがとった行動とは……!?　ひとりの少女と悪魔「邪神ちゃん」が繰り広げるちょっと危険な同居生活コメディ！,https://res.cloudinary.com/hggksoylm/image/upload/v1598081029/Animation/jasinchandropkick_m5ekqq.png,じ,じゃしんちゃんどろっぷきっく
0,ジャングル大帝 ,手塚プロダクション,1965,ジャングルの王、白獅子パンジャは妻エライザを助けようとして、身代わりとなって死んでしまう。人間に捕らえられた妻エライザは輸送船の中で赤ん坊を産み、レオと名づけた。エライザはパンジャの血を引くレオだけは救おうと、嵐の中で沈み行く船からレオを逃がす。白いライオン、パンジャとその子レオを中心にして大自然の中で繰り広げられる弱肉強食の生存競争や、人間と動物とのかかわりなどを描いた大河ドラマ。,https://res.cloudinary.com/hggksoylm/image/upload/v1598081034/Animation/jangurutaitei_pa92uy.png,じ,じゃんぐるたいてい
0,女子高生の無駄づかい,パッショーネ,2019,浪費する、青春──。 WEBコミック誌「コミックNewtype」で大人気連載中の学園ガールズコメディが待望のTVアニメ化決定！ちょっと残念な女子が集う、さいのたま女子高校を舞台に、とてつもないバカ・田中(通称：バカ)、アニメや漫画を愛するオタク女子・菊池(通称：ヲタ)、いつも無表情でロボットのような少女・鷺宮(通称：ロボ)を中心に、個性豊かで魅力的な仲間たちが、女子高生というキラめきに溢れた青春を無駄に浪費していく抱腹絶倒のJK学園コメディが今、幕を開ける！,https://res.cloudinary.com/hggksoylm/image/upload/v1598081040/Animation/josikoseinomudazukai_nxfa06.png,じ,じょしこうせいのむだづかい
0,じょしらく,J.C.STAFF,2012,落語家のお仕事は、もちろん寄席で一席ぶつこと。でも寄席が終わった後に楽屋でだらだら続ける雑談の方が面白いかも……そう思えるような五人の女性落語たちがいた。ツッコミ役の姉御肌だけど体型は子供の魔梨威。みんなの暴走をおさえる気配り上手の手寅。かわいらしい外見とは裏腹に腹黒い内面がちらほら見える木胡桃。シニカル武闘派メガネっ娘の丸京。妄想力抜群なダークサイドの住人・苦来。彼女たちが繰り広げる会話は、ときにまったり、ときに暴走。気づいてみれば放送コードギリギリのラインを突っ走り、たまにラインの向こうへ抜けてしまって帰ってこない。そんな彼女たちの会話は、はたしてちゃんとテレビで放送できるのか……？,https://res.cloudinary.com/hggksoylm/image/upload/v1598081045/Animation/josiraku_yxg1ii.png,じ,じょしらく
0,ジョジョの奇妙な冒険,david production,2012,【第1部】古代メキシコで繁栄を遂げた太陽の民アステカ。彼らには奇妙な｢石仮面｣が伝わっていた。それは、永遠の命と真の支配者の力をもたらすという奇跡の仮面。だが、ある時を境に歴史から姿を消す。やがて時は過ぎ、19世紀後半。人々の思想と生活が激変していた時代に出会った、ジョナサン・ジョースターとディオ・ブランドー。2人は少年時代から青年時代を共に過ごし、やがて｢石仮面｣を巡って数奇な運命を辿ることとなる――。／【第2部】ジョナサンの死から49年後。時は移り、世代も変わる。石油王となったスピードワゴンは財団を設立し、ストレイツォは老師トンぺティに代わり、波紋使い一派の後継者となっていた。その頃、スピードワゴン財団が派遣した遺跡発掘隊により、メキシコのある遺跡にて一体の奇妙なミイラが発見される。そのミイラの傍らには、あの忌まわしき石仮面のレリーフが刻まれていた…！ジョースター家と石仮面を巡る因縁は未だ終わらず…！,https://res.cloudinary.com/hggksoylm/image/upload/v1598081051/Animation/jojo_ff7dnq.png,じ,じょじょのきみょうなぼうけん
