0,ジョジョの奇妙な冒険 スターダストクルセイダース,david production,2014,時は1987年――ジョセフ・ジョースターと柱の男たちとの死闘から49年後…。ジョセフは｢悪霊に取り憑かれた｣という孫・空条承太郎に会うため、極東の地・日本を訪れる。そして承太郎に対し、悪霊――｢幽波紋(スタンド)｣が突如発現した原因を語る。それは、100年に渡る長き眠りから目覚めた吸血鬼・DIOと、ジョースター家の忌まわしき因縁によるものだった。さらに、DIOのもたらした悪影響によって倒れ伏す承太郎の母・ホリィ。承太郎は母を救うため、全ての元凶にして邪悪の化身であるDIOを打倒すべく、仲間達と共に旅立つ…。,https://res.cloudinary.com/hggksoylm/image/upload/v1598081056/Animation/jojo2_ps9arv.png,じ,じょじょのきみょうなぼうけんすたーだすとくるせいだーず
0,ジョジョの奇妙な冒険 ダイヤモンドは砕けない,david production,2016,エジプトでの宿敵DIOとの死闘から11年後。1999年、空条承太郎は祖父ジョセフ・ジョースターの隠し子、東方仗助に会うため、日本のM県S市、杜王町にやってきた。しかし発見した仗助は承太郎と同じ特殊能力、｢スタンド｣を持っていた。そして、承太郎の来訪を皮切りにまるで引かれ合うように、新たな｢スタンド使い｣達が動き始める。｢この町には何かがある…｣生まれ育った杜王町を守るため、仗助は立ちあがる――。,https://res.cloudinary.com/hggksoylm/image/upload/v1598081062/Animation/jojodaiamondhakudakenai_aqf8og.png,じ,じょじょのきみょうなぼうけんだいやもんどはくだけない
0,ジョーカー・ゲーム,Production I.G,2016,世界大戦の火種がくすぶる昭和12年秋、帝国陸軍の結城中佐によって、スパイ養成部門“D機関”が秘密裏に設立される。生え抜きの軍人を尊ぶ陸軍の風潮に反し、機関員として選ばれたのは、東京や京都といった一般の大学を卒業し、超人的な選抜試験を平然とくぐり抜けた若者たちだ。彼らは魔術師のごとき知略を持つ結城中佐のもと、爆薬や無電の扱い方、自動車や飛行機の操縦法はもちろん、スリや金庫破りの技に至るまで、スパイ活動に必要なありとあらゆる技術を身につけ、任地へと旅立っていく。｢死ぬな、殺すな｣??目立たぬことを旨とするスパイにとって自決と殺人は最悪の選択肢であるとするD機関は、陸軍中枢部から猛反発を受けつつも、味方を欺き、敵の裏をかき、世界中を暗躍する。東京、上海、ロンドン……世界各地で繰り広げられるインテリジェンス・ミステリー。,https://res.cloudinary.com/hggksoylm/image/upload/v1598081068/Animation/jokergame_hp4hqv.png,じ,じょーかーげーむ
0,人外さんの嫁,サエッタ,2018,ごくごく普通の男子高校生・日ノ輪 泊は、ある日担任の先生に呼び出され、不思議な生き物「カネノギさん」の結婚相手に決まったと告げられる。戸惑いながらも婚姻届を出した二人だが、新婚生活は案外しあわせ一杯で…!?ふわふわもふもふ人外さん×男子高校生のあま～い新婚生活、スタート！,https://res.cloudinary.com/hggksoylm/image/upload/v1598081074/Animation/zingaisannoyome_k2zp7s.png,じ,じんがいさんのよめ
0,人類は衰退しました,AIC ASTA,2012,わたしたち人類がゆるやかな衰退を迎えて、はや数世紀。すでに地球は“妖精さん”のものだったりします。のんびり、ほのぼ、の……？　ちょっぴり不思議でほんの少し不条理な、そんな物語のはじまりです。,https://res.cloudinary.com/hggksoylm/image/upload/v1598081081/Animation/zinruihasuitaisimasita_awos4i.png,じ,じんるいはすいたいしました
0,好きっていいなよ。,ゼクシズ,2012,１６年間、彼氏も友達も作らずにきた橘めい。ある日、誤解で学校一のモテ男・黒沢大和にケガをさせてしまうが、なぜか大和はめいを気に入って一方的に友達宣言。さらに、めいをストーカーから守ってくれたうえに、守るためとキスまでしてきて…！？　大ブレイク中の葉月かなえが描くリアル初恋ストーリー！,https://res.cloudinary.com/hggksoylm/image/upload/v1598092904/Animation/sukitteiinayo_lv08nz.png,す,すきっていいなよ
0,好きになるその瞬間を。～告白実行委員会～,Qualia Animation,2016,出会いは最低だったのにいつの間にか雛の胸は高鳴っていく。雛は中学の先輩・恋雪に惹かれ同じ高校に進学を決意して猛勉強。幼なじみの虎太朗と桜丘高校に入学する。冴えなかった恋雪は片思いの相手の為に、休み明けにイメチェンしてモテ始める。そんな状況に雛は「告白」決意するけれど――！？動画総再生回数4億回を超えるクリエーターユニットHoneyWorksが生んだ恋愛青春ストーリー決定版第2弾！,https://res.cloudinary.com/hggksoylm/image/upload/v1598092904/Animation/sukininarusonosyunkanwo_l9rnsa.png,す,すきになるそのしゅんかんをこくはくじっこういいんかい
0,スクールガールストライカーズ Animation Channel,J.C.STAFF,2017,新生私立女子高・五稜館学園。この学園には知られざる裏の顔がある――。時空の歪みから現れる、謎の妖魔「オブリ」。この人類の敵に対抗できるのは、五次元空間を探知できる能力を持った「ストライカー」と呼ばれる少女達のみ。五稜館学園は素養を持つ少女達をスカウトし、オブリを討伐する戦闘部隊、「フィフス・フォース」を育成する機関でもあった。新たに結成されたチーム 「アルタイル・トルテ」に所属する５人の少女達の、戦いと友情の物語が幕を開ける!!,https://res.cloudinary.com/hggksoylm/image/upload/v1598092901/Animation/schoolgirlstrikers_iuv0zf.png,す,すくーるがーるすとらいかーず
0,涼宮ハルヒの憂鬱,京都アニメーション,2009,｢この中に宇宙人、未来人、超能力者がいたら、あたしのところに来なさい。以上!｣入学早々、時を止めるような挨拶をした涼宮ハルヒ。そんなSF小説じゃあるまいし…と、誰でもそう思う…。しかしハルヒは心の底から真剣だった。それに気づいたキョンをとりまく日常は、もうすでに超常になっていた…。涼宮ハルヒが団長の学校未公式団体｢SOS団｣が繰り広げるSF風味の学園ストーリー。,https://res.cloudinary.com/hggksoylm/image/upload/v1598092900/Animation/suzumiyaharuhinoyuuutu_v1fxcp.png,す,すずみやはるひのゆううつ
0,スタンドマイヒーローズ　PIECE OF TRUTH, M.S.C,2019,『スタンド（STand Alone National Department）』麻薬取締官、刑事、情報屋、著名人、名家の人間といった官民に関係なく適正のある者で構成された、薬物絡みの事件を取り扱う独立捜査機関。新人マトリである泉玲は、スタンドの候補者として選出されたメンバーのスカウト役に任命される。その候補者として選出されたメンバーを待ち受けていたのは、異なる正義を持つ組織間の対立と、謎のドラッグに紐付く未解決事件であった。彼らがたどりつく真実とは―――,https://res.cloudinary.com/hggksoylm/image/upload/v1598092902/Animation/standmyheros_tro5l0.png,す,すたんどまいひーろーず
0,ステラ女学院高等科C3部（しーきゅーぶ）,GAINAX,2013,高まる鼓動、膨らむ妄想…。憧れていた「ステラ女学院」への入学が決まり、高校での新生活に胸を躍らせる大和ゆら。「もしかしたら…ここなら私、変われるかも！」。期待に胸を膨らませ寮の自室で横になると枕の下に「デザートイーグル」がっ…!! 女子高生!? C3部（しーきゅーぶ）!!? サバゲー!!!? そんな青春サバゲーストーリーが今…はじまる！,https://res.cloudinary.com/hggksoylm/image/upload/v1598092901/Animation/ccube_iraoey.png,す,すてらじょがくいんこうとうかしーきゅーぶ
0,ステラのまほう,SILVER LINK,2016,高校の入学式の日、同人ゲームを作る部活｢SNS部｣と出会った本田珠輝。やりたいことを見つけたと思って入部したものの、絵もプログラムもシナリオも音楽も、一から自分たちで作るのって大変！先輩や幼なじみと一緒に、完成を目指して頑張ります！,https://res.cloudinary.com/hggksoylm/image/upload/v1598092902/Animation/steranomahou_ofbxd9.png,す,すてらのまほう
0,ストライクウィッチーズ,GONZO,2007,20世紀初頭。突如出現した異形の敵｢ネウロイ｣は次々と人類の街を侵略していった。それに対抗できる手段はただ一つ、魔力を持った少女(ウィッチ)のみ。彼女たちは、自らの体に兵器(ストライカー)をまとい、空を舞いネウロイに戦いを挑む。ネウロイの侵略に窮地に追い込まれた人類に残された希望、それは世界各国から最前線ブリタニアに集められ組織された第501総合戦闘航空団。空を駆ける戦乙女。救国の英雄。民衆の憧憬と賞賛を一身に受けて戦う。彼女たちはいつしかこう呼ばれるようになっていた ―― ｢ストライクウィッチーズ｣と。,https://res.cloudinary.com/hggksoylm/image/upload/v1598092903/Animation/strikewitches_awzizl.png,す,すとらいくうぃっちーず
0,ストライク・ザ・ブラッド,SILVER LINK.,2013,世界最強の吸血鬼と剣巫の少女が織りなす物語が、今、幕を開ける──！！“第四真祖”──それは伝説の中にしか存在しないはずの、世界最強の吸血鬼。十二体もの眷獣(けんじゅう)を従え、災厄を撒き散らすといわれる幻の吸血鬼が、日本に出現したという。その“第四真祖”を監視と抹殺のため、政府・獅子王機関は“剣巫(けんなぎ)”と呼ばれる攻魔師の派遣を決定。しかしなぜか監視役として選ばれたのは、見習い“剣巫”の少女、姫柊雪菜だった。対真祖用の最強の霊装を携え、魔族特区“絃神市”を訪れる雪菜。そこで彼女が遭遇した“第四真祖”暁古城の正体とは──！,https://res.cloudinary.com/hggksoylm/image/upload/v1598092903/Animation/striketheblood_as5dff.png,す,すとらいくざぶらっど
0,すのはら荘の管理人さん,SILVER LINK.,2018,見た目のせいで男扱いされてこなかった椎名亜樹は、自分を変えようと中学校入学を機に東京へ出てすのはら荘に入寮する。そこで亜樹を待っていたのは、天然でいたずら好きなすのはら荘の管理人さん・春原彩花に心も体もかわいがられる毎日だった。さらに、ほかの同居人も全員年上の女の子で…。いやしとドキドキがたっぷりで、ついつい管理人さんに甘えたくなっちゃう年の差（おねショタ）ラブコメ決定版！,https://res.cloudinary.com/hggksoylm/image/upload/v1598092904/Animation/sunoharasounokanrininsan_oav9t7.png,す,すのはらそうのかんりにんさん
0,スペースアドベンチャー　コブラ,東京ムービー新社,1982,３姉妹をめぐって、コブラとクリスタルボーイが激突　賞金稼ぎのジェーンは、自分に言い寄ってきた男が海賊コブラだと知り、用心棒を依頼。目的は、彼女の３つ子の姉妹キャサリンとドミニクを探すことだった。コブラはジェーンと共に、クリスタルボーイに監禁されているキャサリンを救出に向かう。だが、クリスタルボーイの命令に忠実なキャサリンは、ジェーンを裏切る。コブラはジェーンの残したメッセージに従って、ドミニクに会いに行く。だが、そこへも大軍団を引き連れたクリスタルボーイが現れた！,https://res.cloudinary.com/hggksoylm/image/upload/v1598092902/Animation/spaceadventuerkobra_wmmv21.png,す,すぺーすあどべんちゃーこぶら
0,スラムダンク,東映アニメーション,1993,桜木花道は、中学校三年間で50人もの女子生徒にふられ続けた悲しい男。50人目の女子生徒に｢私、バスケット部の小田君が好きなの｣と言われたショックが尾を引いて、湘北高校へ入学してからも“バスケット”という言葉に異常に反応し、立ち直れない状態だった。そんなある日のこと、廊下で一人の美少女から声をかけられる。｢バスケットはお好きですか？｣その女生徒・晴子がモロに自分の好みであったため、花道は何のためらいもなく｢大好きです！！｣と答えてしまう。いつか憧れの晴子と一緒に登下校する日を夢見て、花道はバスケットのトレーニングを始める。しかし、晴子にはバスケ部のルーキー流川楓に憧れていたのだった。その事実を知った直後、バスケット部の練習中のボールが偶然花道の顔面に…怒る花道は猛然とバスケット部員たちに襲いかかるのだった。そこにバスケット部キャプテンの赤木が登場、花道はこよなくバスケットを愛する赤木の面前でバスケ部のことを｢玉入れ遊び部｣と侮辱し、赤木を怒らせてしまい、バスケットで赤木と勝負することになる。果たして初心者・花道はこの無謀な勝負に勝てるのか！？同じ部に所属するスーパールーキー流川の存在、絶大な存在感を誇るキャプテン赤木に触発されながら成長を続ける桜木花道は必見。また晴子や洋平を中心とする桜木軍団など登場人物も個性豊かにストーリーを盛り上げる！天才・仙道をはじめとする陵南、神奈川NO.1プレイヤー牧率いるインターハイ常連の海南、藤真を擁し、抜群の高さを武器にする翔陽など強豪校のライバルたちに初心者・桜木花道が立ち向かう。果たして強豪ひしめく神奈川県で湘北高校は勝ち進んでいくことができるのか？そして湘北キャプテン・赤木の全国制覇の夢はかなうのか？自称・“天才”の桜木花道の戦いが今始る！！,https://res.cloudinary.com/hggksoylm/image/upload/v1598092901/Animation/slamdunk_fq4q5c.png,す,すらむだんく
0,スロウスタート,A-1 Pictures,2018,この春から高校一年生になる、人見知りな女の子、一之瀬花名。彼女はとある理由から都会の両親のもとを離れ、いとこの志温が管理人を務めるアパート”てまりハイツ”で暮らしている。新しい高校、新しい毎日の中で起こる、素敵な出会いの数々。花名はまわりの人たちとゆっくり心を通わせて、楽しくてきらきらとした時間を過ごしていく。子供みたいにはしゃいだり、大人みたいにドキドキしたり……かわいさ溢れ、心あたたまる、スロウな成長物語。,https://res.cloudinary.com/hggksoylm/image/upload/v1598092902/Animation/slowstart_ecqale.png,す,すろうすたーと
0,ずっと前から好きでした。～告白実行委員会～,Qualia Animation,2016,これが最後の練習だから――。桜丘高校3年の榎本夏樹は、幼なじみの瀬戸口優に片思い中。けれど、素直になれず、優を告白の“練習”相手だと言ってしまう。ホントの気持ちをごまかし続ける中、夏樹はクラスメイトの綾瀬恋雪にデートに誘われるけど…?夏樹の“練習”は“本番”をむかえることができるの!?,https://res.cloudinary.com/hggksoylm/image/upload/v1598092900/Animation/zuttomaekarasukidesita_ooomdm.png,ず,ずっとまえからすきでしたこくはくじっこういいんかい
0,正解するカド,東映アニメーション,2017,真道幸路朗（しんどう・こうじろう）は、外務省に勤務する凄腕の交渉官。羽田空港で真道が乗った旅客機が離陸準備に入った時、空から謎の巨大立方体が現れる。“それ”は急速に巨大化し、252人の乗った旅客機を飲み込んでしまう。巨大立方体の名は「カド」。カドより姿を現した、謎の存在・ヤハクィザシュニナは人類との接触を試みようとする。カドに取り込まれた真道は、ヤハクィザシュニナと人類の間の仲介役を引き受けることになる。一方、日本政府も国際交渉官の徭沙羅花（つかい・さらか）を代表として現場へ送り込む。 ヤハクィザシュニナとは何者か。そして彼の狙いは何か。,https://res.cloudinary.com/hggksoylm/image/upload/v1598095166/Animation/seikaisurukado_m1mnru.png,せ,せいかいするかど
0,青春ブタ野郎はバニーガール先輩の夢を見ない, CloverWorks,2018,思春期症候群――不安定な精神状態によって引き起こされるとネットで噂の不思議現象。梓川咲太、高校2年生。江ノ島からもほど近いとある高校に通う彼は、この年、様々な“思春期症候群”を引き起こした少女達と出会う。たとえばそれは、図書館で出会った野生のバニーガール。彼女の正体は、高校の上級生にして活動休止中の女優、桜島麻衣先輩。魅惑的な彼女の姿は、何故か周囲の人間の目には映っていなかった。彼女はなぜ見えなくなってしまうのか―。謎の解決に乗り出した咲太は、麻衣と過ごす時間の中で、彼女の秘める想いを知り……。空と海が輝く町で心揺れる少女達との不思議な物語が始まる。,https://res.cloudinary.com/hggksoylm/image/upload/v1598095166/Animation/aobuta_bjolzg.png,せ,せいしゅうぶたやろうはばにーがーるせんぱいのゆめをみない
0,セイレン,Studio五組/AXsiZ,2017,高校２年生の夏。「嘉味田正一」は進路希望表の内容で担任に呼び出されたことをきっかけに、大人になることへの不安を覚えはじめる。そんな彼が様々な女の子と出会い・・・・・・そしてどんな将来を目指していくのか。未来に向かって駆け出す等身大の高校生と清廉（セイレン）可憐なヒロインたちの恋愛物語が、今始まる！,https://res.cloudinary.com/hggksoylm/image/upload/v1598095166/Animation/seiren_k0oja2.png,せ,せいれん
0,聖闘士星矢,東映アニメーション,1986,この世に邪悪がはびこるとき、必ずや現れるという希望の闘士・聖闘士（セイント）。聖闘士になるため、ギリシアで修行していたペガサスの聖闘士・星矢は、聖衣を手に入れて日本に帰国する。彼を待っていたのは、グラード財団が企画した銀河戦争（ギャラクシアンウォーズ）と呼ばれる聖闘士同士の戦いだった。,https://res.cloudinary.com/hggksoylm/image/upload/v1598095166/Animation/seintoseiya_fmpjmk.png,せ,せいんとせいや
0,世界でいちばん強くなりたい！,アームス,2013,国民的アイドルグループ『Sweet Diva』で人気を二分する萩原さくらと宮澤エレナは、ライバルでもあり、また、お互いを認め合う大切な仲間でもあった。ある日、TV番組の収録で『ベルセルク』のプロレスラー・風間璃緒と絡んだエレナは、プロレス技を受け怪我をしてしまう。大切なものを傷つけられたさくらは、エレナの仇を取る為、プロレス勝負を挑むのだった。さくらは闘いの末に何を見つけるのか！？,https://res.cloudinary.com/hggksoylm/image/upload/v1598095167/Animation/sekaideitibantuyokunaritai_wzmimu.png,せ,せかいでいちばんつよくなりたい
0,セキレイ,セブン・アークス,2008,｢さぁ、始めようか―― 新しい神話を 可憐な戦記を 奇跡の恋物語を――｣2020年、新東帝都にそびえ立つビルの屋上で、一人の男がそう宣言した。それは｢鶺鴒計画｣の始まりを告げる合図。“セキレイ”と呼ばれる108羽の可憐な戦士たちは、自らの主・葦牙(アシカビ)を求めて人の世へと放たれた――――自らの想いを賭けて、最後の一羽と成る為に。｢ごめん、今年もダメだった・・・｣憧れの都会に上京したものの、大学受験に失敗したさえない浪人生・佐橋皆人。彼は、やりたい事も無く・親しい友人もおらず・ましてや彼女なんているわけもない、いわゆるヘタレ。しかもその日、2浪が決定したばかりだった。厳しい現実に、落ち込みながら帰路に付く皆人。そんな彼の前に、突然、空から謎の美少女が降ってきた。彼女の名は“結”。自らを“セキレイ”と名乗る彼女は、運命の相手“葦牙”として皆人を選んだのだった。｢私、皆人さんのために闘います!｣そして皆人と結の絆が刻まれたとき、物語は動き始める――これは、人とセキレイが織り成す、新しい神話 これは、セキレイ達が繰り広げる、可憐な戦記 これは、運命の相手と紡ぎ出す、奇跡の恋物語。全ては、愛する者と永遠に婚ぐ為に――――――,https://res.cloudinary.com/hggksoylm/image/upload/v1598095166/Animation/sekirei_xpspnc.png,せ,せきれい
0,selector infected WIXOSS,J.C.STAFF,2014,巷で中高生を中心に大人気のカードゲーム｢WIXOSS(ウィクロス)｣。だがそのカードの中に｢意志を持つ少女キャラのカード｣=ルリグカードがあることを知る者は少ない。ルリグの声は特別な少女だけが聴くことが出来、そのカードの持ち主はセレクターと呼ばれていた。そしてセレクターたちは、誰もがそれぞれの｢願い｣を抱いて、普通の人間には感知出来ないフィールド内でカードバトルを繰り広げている。なぜなら、セレクター同士のバトルに勝ち続ければ、自分の｢願い｣が叶うと言われているから。小湊るう子はWIXOSSを初めて手にしたその時、ルリグの声を聴いた。驚きと困惑の彼女の前に、同じ学校の生徒でセレクターの紅林遊月にバトルを挑まれる。るう子は要領を得ぬまま、自分のルリグをタマと名付けて、否応なしにセレクターとして戦うことに……。希望、願望、欲望。それぞれの想いを胸に、少女たちは危険なゲームの渦に飲み込まれていく──,https://res.cloudinary.com/hggksoylm/image/upload/v1598095170/Animation/wixoss_zwptg1.png,せ,せれくたーいんふぇくてっどうぃくおす
0,戦姫絶唱シンフォギア,サテライト,2012,世界各国を脅かす、認定特異災害――『ノイズ』。ノイズと接触した人間は、体組織を炭素の塊と変えられ、為す術も無く崩れ落ちてしまう。ノイズこそ、まさに人類の天敵。各国軍組織は、最新・先鋭の戦術兵器を駆使してその殲滅にあたるものの、ノイズに対しては有効打となりえず、いまだ対処法を見出すことはできない。だが、日本政府は、他国に先んじて、対ノイズの切り札とも呼べる兵器の開発に成功する。兵器の名は『シンフォギア』。当代トップのボーカルユニット、『ツヴァイウィング』の風鳴 翼と天羽 奏は、アーティストであると同時に、シンフォギアを身にまとい、ノイズから人類を守る戦士でもあった。翼と奏の唄う歌に導かれるかのようにして、立花 響と小日向 未来の運命もまた大きく動きはじめる。『覚醒の鼓動』は、すぐそこにまで迫りつつあった。,https://res.cloudinary.com/hggksoylm/image/upload/v1598095170/Animation/zekkyousensisymphogear_vji7s5.png,せ,せんきぜっしょうしんふぉぎあ
0,戦国BASARA,プロダクションI.G,2009,時は、群雄割拠の戦国時代―天下を狙うつわものたちが、全国各地で鬨を上げた。高まる乱世の機運。武将たちによって、開かれた戦端はたちまち全国を席巻し戦国の世の勢力図は、めまぐるしく塗り替えられていった。名だたる猛将達のあくなき戦いの中、天下は尾張の第六天魔王・織田信長が、手中に収めようとしていた。だが、北から蒼の装束に身を包んだ隻眼の若き武将が無数の騎馬軍団を従え、名乗りをあげた。その男は、奥州筆頭・独眼竜こと伊達政宗。狙うは信長の首、天下統一!,https://res.cloudinary.com/hggksoylm/image/upload/v1598095167/Animation/sengokubasara_rqjsqe.png,せ,せんごくばさら
